aspect,n_mentions,n_posts,share_negative,mean_sent,keep,category,notes,sample_sentence,sample_doc_id
algorithm,22,18,0.3636363636363636,-0.0538363636363636,y,discovery,"discoverability core complaint — pair with 'ranking', 'view', 'engagement'","Now I don't think they didn't even checked the first page of it, but for me it's kinda strange that my story is still locked at 28 views, I don't think the algorithm is so bad there.",t3_1sh3r42
fun,22,19,0.1363636363636363,0.5024227272727274,n,generic,,"To go from someone who wrote for fun to a verified Goodreads author, I can't thank all the stars enough 😭😭😭😭☺️🙏",t3_1sw7vk3
detail,22,22,0.2727272727272727,0.0967409090909091,n,generic,,"I’m quite excited writing and polishing the details, but I don’t know if anyone will read it since the fandom is completely dead.",t3_1sjmnkq
new story,21,21,0.1904761904761904,0.3532714285714285,n,generic,,but I just witnessed the scam bots becoming scary I just wrote a new story on Wattpad,t3_1szebmi
fandom,21,15,0.1904761904761904,0.2086857142857142,y,community,,"I’m quite excited writing and polishing the details, but I don’t know if anyone will read it since the fandom is completely dead.",t3_1sjmnkq
kingdom,21,8,0.5238095238095238,-0.2140047619047618,n,content_topic,,"It was all in vain however, as the battles between the elements destroyed what was left of the castle, killing almost every human, leaving the king with no Kingdom and no citizens left to defend.",t3_1sxa13l
choice,21,21,0.3809523809523809,-0.0519809523809523,n,generic,,"If you're someone who enjoys the genre, that’s your choice and im not saying u cant enjoy it, but turning a ""bad boy"" into a stereotypical mafia boss for the sake of drama and allure isn't just misleading, it's disrespectful to those who ha",t3_1lj5s7r
death,21,20,0.7142857142857143,-0.2744285714285714,n,content_topic,,"Please proceed with caution if you are sensitive to any of the following:

**Violence &amp; Gore** – depictions of physical harm, blood, death, and body horror.",t3_1ookvfj
attention,21,21,0.238095238095238,0.2542476190476191,y,discovery,,"I see someone crying over how their book doesn't get any attention, but especially when they're so very salty about other stories that do, and I click on their work and read their description and more often than not read their first and sec",t3_1hnfukn
journey,20,20,0.2,0.202545,n,generic,,"I've finally got my Wattpad novel to paperback :D. It's a hell of a journey to apply for the ISBN at the National Library of Malaysia and get these printed at the printing press nearby, but after a month, I've finally got them printed!",t3_1q63iz4
language,20,19,0.15,0.1232249999999999,y,platform_feature,,Please don't send me your fantasies that you forced some ai that does not care what language it is writing for review.,t3_1tbxd83
artist,20,15,0.25,0.0969499999999999,y,service,,We're living in an age where artists and writers and now seen as disposable due to the advent of AI; a technology that steals from other artists and fabricates their work while destroying the planet.,t3_1k66jqc
round,20,9,0.1,0.118455,n,generic,,"**

\-&gt; Then drop your link in comments

**\*Important\***:

\-&gt; First 10 who follow ALL instructions above

\-&gt; **I WILL skip comments that just drop links without context**

\-&gt; Selections made within 48 hours

\-&gt; Feedback",t3_1qqdgl1
website,20,17,0.2,0.1059949999999999,y,platform_feature,,"The first time I hit ""preview"" after I pasted a piece of my writing (on the website), it merges together around 500 hundred words 😭​​. This happens in every new chapter.",t3_1suhdcu
email,20,14,0.25,-0.0390299999999999,y,platform_feature,,"they didnt even ask for fucking verification in the same email i was told ""we dont take identity verficiation as proof of ownership but since you said the birthday was lied about we are closing it because that violates the terms of service""",t3_1suqpi9
return,20,17,0.05,0.595175,n,generic,,"All I ask for in return is that you vote on the chapters of my book, I will leave the link in the comments.",t3_1k2bydv
rule,19,14,0.1578947368421052,-0.0268578947368421,y,platform_feature,,"So, im pretty sure this book is a couple years old, i had it in my reading list but its suddenly disappeared, not sure if the author took it down but the plot from what i can remember is;

This abused girl that was forced to marry a billion",t3_1tasmsa
exchange,19,16,0.1578947368421052,0.2890894736842105,y,community,R4R/V4V trade economy — strong competitor research signal,"Now I feel stuck because I don’t want to unfollow or be rude, but I also feel disappointed enough that I can’t bring myself to continue the exchange.",t3_1senye7
advance,19,17,0.0526315789473684,0.4699263157894737,n,generic,,I will apologize in advance for wrong grammar or any technical mistakes I have made.,t3_1t0dkj7
theme,19,17,0.1578947368421052,0.3247263157894737,n,generic,,"**Corruption &amp; Oppression** – abuse of power, government/military control, and themes of rebellion against authority.",t3_1ookvfj
fic,19,16,0.1578947368421052,0.1903684210526316,y,community,,"So just got a comment on a fic of mine calling my character bland because instead of speaking her mind constantly she is cautious and thinks about the possible consequences of her actions for herself, her family and her young children and t",t3_1t4hvx5
money,19,14,0.3684210526315789,0.0995578947368421,y,monetization,37% neg — refused-to-pay or premium-feature complaints,That's what I pay money for to not see them!!!,t3_1sjv15h
case,19,19,0.2105263157894736,0.1273052631578947,n,generic,,"I was over the habit of romanticizing toxic, or in some cases, straight up abuse behavior, by the 2010s with 50 Shades of Grey (which caused people who are educated and experienced in BDSM to be painted as abusers because of how poorly the ",t3_1gj6pjd
trope,19,15,0.1052631578947368,0.4368894736842105,n,content_topic,,Kill for you trope.,t3_1sx5zbj
future,18,18,0.2777777777777778,0.0799388888888888,n,generic,,"But when a plot to resurrect a darkness from his own bloodline also unearths an innocent he once wronged, Alatar must fight for a future he never believed he deserved.",t3_1nrfpbb
new book,18,17,0.0555555555555555,0.2389833333333333,n,generic,,"I posted last week to get some votes for the first five chapters of my new book Camp Mercy, a horror slasher.",t3_1ondi34
message,18,14,0.4444444444444444,-0.1032888888888888,y,platform_feature,44% neg — DM spam? unwanted advances?,Hey so I woke up this morning hoped on Wattpad to check if any of my stories I've read have gotten updated and I see a author just spammed mey Message board I have the message from my notification board screenshoted and it's absolutely ridi,t3_1m5h9md
project,18,15,0.1666666666666666,0.2932055555555555,n,generic,,"also I'm trying not to let the romance feel easy, it's not gonna be as complex as my serious project, but because it's less complex I'm more committed.(But I fear all that might be looked upon just because it's a fanfiction, instead of an o",t3_1slhglk
past,18,15,0.2222222222222222,0.1725611111111111,n,generic,,"Because of these distortions, technology constantly fails in the most affected areas, leaving some cities relatively modern while others seem almost stuck in the past.",t3_1t6dbdw
voice,18,12,0.3333333333333333,0.0270166666666666,n,generic,,"His hands crushed bones, snapped weapons, and silenced voices that had just begun to believe.",t3_1spej3p
heart,18,17,0.0,0.6897166666666668,n,generic,,Will her heart betray her?,t3_1sjy0qr
hope,18,17,0.1666666666666666,0.3450166666666667,n,generic,,"Lastly there's the youngest and most scared one of the three, he always listens to his parents in hope of becoming the King, he doesn't know what's different from right and wrong.",t3_1tf1qwg
ranking,18,14,0.3333333333333333,0.0539666666666666,y,discovery,33% neg — Wattpad's per-tag ranking algorithm is contentious,"I used the Wattpad link in my promos and brought new members in (multiple new accounts that have only my book on a reading list), but there's no referral scheme, and my rankings have been stuck on the bugged ""423 of 425"" kinda numbers for a",t3_1q96s8i
edit,18,17,0.2777777777777778,0.1318222222222222,y,platform_feature,,"i was sobbing and shaking a bit🫠

edit: as of today, 2026.04.28, my second work has crossed over 100 views and is 3 away from 30 votes.",t3_1svwgf0
course,18,16,0.0555555555555555,0.3136388888888889,n,generic,,And of course what would make you leave almost immediately or within the first few chapters.,t3_1sz4pmy
poetry,17,6,0.2352941176470588,0.196035294117647,n,content_topic,,"but recently, i've noticed that poetry on wattpad seems to be... not dying out, but turning into something low effort.",t3_1sprg1n
reddit,17,14,0.0588235294117647,0.3400941176470588,y,competitor,,"Hi,

I have legit never posted on Reddit, so I apologise if I have done anything wrong.",t3_1t7hlvr
city,17,12,0.3529411764705882,0.0472999999999999,n,generic,,"Blurb: When Elle Claude, a thief from the city of Sin Capital, steals a locket from a man in the underground metro, she soon discovers the supernatural ramifications of her actions.",t3_1sml0b2
fear,17,15,0.8235294117647058,-0.3513941176470588,n,content_topic,,I got a little scared of the comment but not too much cause I have lived in fear all through out my childhood to my teens so if you ever see scam comments saying your first and last name don't give in to the fear they are causing you just d,t3_1szebmi
hell,17,14,0.9411764705882352,-0.5832529411764705,n,content_topic,,"Guys helpppp, how the fuck can I hide my votes from my readers because why the fuck does my readers need to know what the hell I am reading and voting?????",t3_1suac5l
mafia,17,11,0.2352941176470588,0.1361882352941176,n,content_topic,,"I want story of an ALTERNATIVE girl, piercings, pale skin, long black hair, struggling, fragile, lost kind of artistry soul in her own world and guy in her age(lil older), white, brown curly hair falling into his face, rough features, dark ",t3_1rynt85
fact,17,12,0.3529411764705882,0.0808470588235293,n,generic,,In fact you're trying so hard to be unique that it reads cringe and forced.,t3_1hnfukn
password,17,6,0.0588235294117647,0.1613529411764706,y,platform_feature,,"I have reported the account, the stories in particular, i've submitted tickets on several occasions, but I can't log in because I forgot my password, and I lost the email tied to the account four years ago.",t3_1t2e86a
review,17,15,0.1764705882352941,0.2314647058823529,y,community,,Please don't send me your fantasies that you forced some ai that does not care what language it is writing for review.,t3_1tbxd83
horror,17,17,0.5882352941176471,-0.0326294117647058,n,content_topic,,"Name: Doctor Stone 

Genre: Horror, Thriller, Detective 

Plot; From the very dawn of humanity, we have grown accustomed to watching demons being expelled from human bodies.",t3_1svnand
genuine,17,13,0.0,0.2935882352941176,n,generic,,Genuine R4R and V4V.,t3_1o3bot4
night,16,15,0.1875,0.1495874999999999,n,generic,,"Grey owns a bar, and is also a secret agent that used to work with her brother, eventually she starts spending the night with him, which her parents dont like, and he doesn’t take her fathers shit and gets physical with him, and takes the f",t3_1ta9bsh
magic,16,11,0.375,-0.13998125,n,content_topic,,"When ancient bloodlines begin to awaken and forgotten magic starts blooming again, alliances shift, secrets unravel, and destiny refuses to stay buried.

🔥 A reluctant heir
🔥 Forbidden love
🔥 Prophecies awakening
🔥 Dragons, Arcana, and dang",t3_1ruww5y
water,16,7,0.125,0.06300625,n,generic,,"Its legs were pillars destroyed by rock and ice, its arms what remained of stone walls that crackled with lightning or drenched in water, its body being held together by pressurized wind while its head was nothing more than a violent purple",t3_1sxa13l
house,16,10,0.3125,0.0036999999999999,n,generic,,"Because the family was poor and couldnt afford his meds the intruder had a mental episode,  went to their house saying the whole fmaily was spies to the country, in his mind he had served the military and needed to take the threats out.",t3_1sfiyb2
site,16,14,0.25,0.0004874999999999,y,platform_feature,,"I tried to search a pairing and I noticed the tag system is not working, I dont know if I just don't know how to navigate in the site but seriously It feel so chaotic and unespecific I almost gave up.",t3_1t5yfr1
change,16,12,0.25,0.26261875,n,generic,,"To save the world, he must first conquer the beast within, but change isn't easy when everyone is waiting for you to fail.",t3_1nrfpbb
school,16,16,0.375,0.1332812499999999,n,generic,,"The school is ruled by:

\- a cruel queen bee

\- a dangerously powerful heir

\- anonymous blackmail secrets



I’m mainly worried about:



\- does the opening hook fast enough?

\- does the dialogue feel cringe/tropey?

\- is the bad boy",t3_1tch939
start,16,16,0.1875,0.05678125,n,generic,,"And also idk if it's a problem or it was never there from the start , i m not getting notifications if someone uploads a new chapter of their book , even though I have added that book to my list , I have followed the author.",t3_1t9bm94
list,15,12,0.1333333333333333,0.2117866666666667,n,generic,,"So, im pretty sure this book is a couple years old, i had it in my reading list but its suddenly disappeared, not sure if the author took it down but the plot from what i can remember is;

This abused girl that was forced to marry a billion",t3_1tasmsa
age,15,15,0.2,0.1321999999999999,n,generic,,"Tune in to my debute release SocialMaddie, a teen girl coming of age but instead of picking out colleges and hanging with peers, shes suffering a illness that will soon take her life.",t3_1slsau1
thriller,15,15,0.2,0.3527333333333332,n,content_topic,,Thriller: the ones with a twist or murder investigation type story.,t3_1sqx4w1
mystery,15,15,0.0,0.5403133333333334,n,content_topic,,"I’m down to read anything in English, but I prefer thriller/horror, romantasy, and mystery!",t3_1tbuggd
bonus,15,15,0.0,0.6172933333333332,y,monetization,,"**Bonus points if it:**

\-is thriller, horror, fantasy or science fiction (but I'm fine with other things)

\-has an interesting psychological conflict

\-is underrated

**I'm not in the mood for:**

\-Smut, excessive swearing and suicide/",t3_1t0lt33
idk,15,14,0.6666666666666666,-0.04124,n,noise,,"I'm looking for a fanfic of Hyunlix ""DESPERATE FOR YOUR TOUCH- By Lorraine"" which got lost Idk when.",t3_1sntl7i
middle,15,15,0.2666666666666666,0.0859999999999999,n,generic,,"Arianna hated being too war, it made her skin sore in a way she couldn't explain, which was why she was stood on frozen sand in the middle of a deserted beach.",t3_1syxjkb
subreddit,15,14,0.1333333333333333,0.3162666666666666,y,community,,"I remember posting eight months ago back in August on this subreddit back when I published the first two chapters, so it’s insane how much time flies!",t3_1svjv15
page,15,14,0.4,-0.08044,y,platform_feature,40% neg — likely reader app page-turn issues OR low-page-view complaint,"Now I don't think they didn't even checked the first page of it, but for me it's kinda strange that my story is still locked at 28 views, I don't think the algorithm is so bad there.",t3_1sh3r42
criticism,15,13,0.5333333333333333,0.0093199999999999,y,community,,"I prefer the feedback on Wattpad as Reddit comments just tend to be unnecessary hostile and never offer any constructive criticism just criticism, full stop.",t3_1snq7z6
sub,15,13,0.1333333333333333,0.27444,y,community,,"And I'm not trying to be mean and discourage anyone, I'm just so tired of this sub becoming a cesspool of salty writers being upset and blaming everyone and everything except their capability of writing a good story that readers want to rea",t3_1hnfukn
tension,15,15,0.6666666666666666,-0.16474,n,generic,,"I really need a book that gives the same vibe me and my ex bf does😭😭

We can’t be together but there is always this tension between us and a week ago we were on a school trip and we were at this place that kinda worked like a boarding schoo",t3_1s5wpdm
shadow slayer,15,11,0.0,0.2394866666666666,n,noise,,"Story name: Shadow Slayer:Sun and Moon 

Second story: Shadow Slayer: Lores and Legends, this is not exactly a story rather a detailed guide on the story's world building, character trivia, character profiles and information of every clan o",t3_1oleop4
truth,15,13,0.2666666666666666,0.2381466666666666,n,generic,,"When he chooses someone else, Aurora's world cracks open, forcing her to confront a truth she's always avoided: destiny doesn't guarantee love.",t3_1t9ct2d
couple,15,15,0.2,0.1861333333333333,n,content_topic,,More posts about supporting struggling authors.. I’ve seen a couple of posts around lately about posting stories for authors who are struggling to find an audience.,t3_1msk185
angst,15,15,0.2,0.2871466666666666,n,content_topic,,"Book with revenge for past romance /hate toward each other / forced marriage / marriage for convenience(with hate)..enemies basically..

  
Tons of angst or tension **(*****not tons of*** **smut) .",t3_1rv77no
space,15,13,0.2666666666666666,0.061,n,generic,,"In the space of one week, fifty-five-year-old Damian Dove has managed to let a serial killer walk free, get caught with a sex worker, anger the media, and get himself fired from his law firm.",t3_1sghgvl
king,15,11,0.3333333333333333,0.1585333333333333,n,content_topic,,"It was all in vain however, as the battles between the elements destroyed what was left of the castle, killing almost every human, leaving the king with no Kingdom and no citizens left to defend.",t3_1sxa13l
deal,15,9,0.2666666666666666,0.1236666666666666,y,monetization,,What’s the deal with scam messages?.,t3_1srvdla
scam,15,8,0.8666666666666667,-0.4653333333333334,y,monetization,87% neg — investigate cover/edit/promo scam patterns,I’ve seen a lot of posts about scam messages and I’m wondering what the scam is?,t3_1srvdla
game,15,7,0.4,0.0313666666666666,n,generic,,"And the straw hats are forced into a game where memories are stolen, personalities are rewritten and blood is refined into magic.",t3_1spgiv4
mafia romance,15,11,0.0666666666666666,0.6909466666666667,n,content_topic,,You think mafia romances are problematic.,t3_1l9ld42
child,15,11,0.4,-0.0241866666666666,n,content_topic,,"We're talking about individuals who have murdered innocents, dissolved children in acid, extorted families, and destroyed entire communities through fear and violence.",t3_1lj5s7r
protagonist,15,12,0.2666666666666666,0.0731999999999999,n,content_topic,,"True Detective

\- Sacred Games

\- Gone Girl

\- Zodiac

\- Delhi Crime

\- noir detective fiction

The protagonist is NOT a clean hero.",t3_1tbsnyt
body,15,12,0.2,0.0538266666666666,n,generic,,"And when their psychic imprint triggers a forbidden bond, their bodies become battlegrounds for history, obsession, and the remnants of a broken covenant no one dares speak of.",t3_1nv5hns
drama,15,15,0.1333333333333333,0.1996399999999999,n,content_topic,,"If you're someone who enjoys the genre, that’s your choice and im not saying u cant enjoy it, but turning a ""bad boy"" into a stereotypical mafia boss for the sake of drama and allure isn't just misleading, it's disrespectful to those who ha",t3_1lj5s7r
interest,15,13,0.1333333333333333,0.5496066666666667,n,generic,,I have no interest in sorting through 1000s of terrible stories to find the hidden gems i am actually interesting in reading.,t3_1md14g6
vampire,15,14,0.2,0.13572,n,content_topic,,"Any Horror stories that have ghosts, vampires, werewolves, monsters, or murderers are what I'm looking for.",t3_1skqiea
topic,14,12,0.4285714285714285,0.0564071428571428,n,generic,,Because I didn't find many books about that topic specifically on Wattpad and I'm worried that no one will read it at all.,t3_1sguj6l
fan fiction,14,13,0.1428571428571428,0.2709785714285714,n,content_topic,,It's a Devil May Cry fan fiction!!,t3_1ooq7pg
progress,14,14,0.0714285714285714,0.3853142857142857,n,generic,,"I wouldnt want to publish great books and then undermine progress by publishing a not so great one (still GOATED, just not as good).",t3_1sy7izd
text,14,12,0.0,0.11325,n,generic,,You can't just take a photo and add some text over it?,t3_1k66jqc
home,14,11,0.2857142857142857,0.1074142857142857,n,generic,,"But when their lives change as they get pulled into a war far from home, much bigger than both of them, they will have to face new enemies, threats and rivals unlike anything they encountered before while untold feelings slowly crawl out of",t3_1ssyf8u
concept,14,10,0.3571428571428571,0.1105,n,generic,,"I tried sharing a concept for a cover I had created and instead of people offering constructive criticism, everyone just dunked on it - someone even calling it shit.",t3_1sxiyjz
adam,14,1,0.2857142857142857,0.0101785714285714,n,noise,,"Adam exhaled, a sound of mild irritation.",t3_1t0dkj7
visibility,14,9,0.1428571428571428,0.4077857142857142,y,discovery,,The real issue is how badly this messes with visibility and algorithm targeting.,t3_1sle6od
