aspect,n_mentions,n_posts,share_negative,mean_sent,keep,category,notes,sample_sentence,sample_doc_id
story,1137,612,0.1530343007915567,0.2422578715919086,n,generic,,"I want story of an ALTERNATIVE girl, piercings, pale skin, long black hair, struggling, fragile, lost kind of artistry soul in her own world and guy in her age(lil older), white, brown curly hair falling into his face, rough features, dark ",t3_1rynt85
book,698,422,0.1275071633237822,0.2571737822349571,n,generic,,"SOO plss some books, but no dark romance or abusive shit in the name of enemies to lovers.",t3_1skzb37
chapter,485,308,0.1154639175257732,0.178924329896907,n,generic,,Whenever I would skip ads I would always just click on the next chapter on the contents page but has wattpad flagged it because I’ve started seeing ads even when I’m doing that and I’m so annoyed because that was the lowkey the only thing k,t3_1szzdy4
comment,299,231,0.1872909698996655,0.1736424749163879,y,platform_feature,19% neg + n=299 — comment toxicity / spam / dead-comment-section,I got a little scared of the comment but not too much cause I have lived in fear all through out my childhood to my teens so if you ever see scam comments saying your first and last name don't give in to the fear they are causing you just d,t3_1szebmi
read,213,147,0.0845070422535211,0.2327793427230046,n,generic,,horror read for read!.,t3_1oy9owh
reader,202,150,0.1683168316831683,0.2676247524752473,y,community,,"Guys helpppp, how the fuck can I hide my votes from my readers because why the fuck does my readers need to know what the hell I am reading and voting?????",t3_1suac5l
link,202,177,0.2029702970297029,0.1605386138613862,y,platform_feature,,"I updated the post to remove the link, I’m looking for a little feedback on the first two chapters, I’m a little nervous because I’m not the best writer, my grammar is atrocious so be warned.",t3_1t1zj0l
feedback,182,140,0.0604395604395604,0.3205164835164835,y,community,,"I prefer the feedback on Wattpad as Reddit comments just tend to be unnecessary hostile and never offer any constructive criticism just criticism, full stop.",t3_1snq7z6
vote,141,97,0.2482269503546099,0.1251241134751773,y,platform_feature,25% neg — vote-trading frustration,"Guys helpppp, how the fuck can I hide my votes from my readers because why the fuck does my readers need to know what the hell I am reading and voting?????",t3_1suac5l
work,137,107,0.1167883211678832,0.3232985401459853,n,generic,,We're living in an age where artists and writers and now seen as disposable due to the advent of AI; a technology that steals from other artists and fabricates their work while destroying the planet.,t3_1k66jqc
writing,115,96,0.1391304347826087,0.3295808695652173,n,generic,,"Feels a little shitty because it was one of the first pieces i actually finished writing, and i miss it now.",t3_1te3k6e
romance,110,91,0.1181818181818181,0.5353054545454548,n,content_topic,,My choice of preferences for stories is anything that is not romance related or atleast not romance focused.,t3_1nx01w3
character,110,89,0.1909090909090909,0.2259172727272727,n,content_topic,,"The basic summary of the plot and characters are as follows, i dont remember both characters name but the mans name is Grey, its a romance story, Basically the female main characters home life is terrible, her father drinks and is abusive a",t3_1ta9bsh
writer,107,91,0.102803738317757,0.3163822429906543,y,community,,"I was over the habit of romanticizing toxic, or in some cases, straight up abuse behavior, by the 2010s with 50 Shades of Grey (which caused people who are educated and experienced in BDSM to be painted as abusers because of how poorly the ",t3_1gj6pjd
post,102,73,0.1470588235294117,0.1933745098039216,n,generic,,"NO REASON TO CALL ANYONE WHAT THEY DID AND TO procced to call me the reason women don't feel safe around men like what the fuck I was just reading a story I'm sorry that I like reading and the premise of your story was decent 

P.S lf possi",t3_1m5h9md
love,98,79,0.1020408163265306,0.5762397959183673,n,generic,,"When ancient bloodlines begin to awaken and forgotten magic starts blooming again, alliances shift, secrets unravel, and destiny refuses to stay buried.

🔥 A reluctant heir
🔥 Forbidden love
🔥 Prophecies awakening
🔥 Dragons, Arcana, and dang",t3_1ruww5y
author,92,71,0.2065217391304347,0.1683130434782609,y,community,,But the problem is that I absolutely hate when the author don't finish their book .. it haunts me in my sleep!,t3_1t1qh6a
genre,88,71,0.125,0.3779261363636365,n,generic,,"If you're someone who enjoys the genre, that’s your choice and im not saying u cant enjoy it, but turning a ""bad boy"" into a stereotypical mafia boss for the sake of drama and allure isn't just misleading, it's disrespectful to those who ha",t3_1lj5s7r
word,83,66,0.180722891566265,0.142966265060241,n,generic,,"We noticed that trying to write Text Message/Chat conversations in Word or Google Docs is a pain, and pasting them into Wattpad usually ruins the formatting.",t3_1pgzovd
life,83,68,0.3855421686746988,0.0055108433734939,n,generic,,"But among all the people they thought they could deceive, they chose a cold-blooded, cruel, and ruthless man named Brian Stone — a man who had suffered from early-stage brain cancer for half his life and who, for many years, has devoted him",t3_1svnand
view,80,63,0.25,0.1301412499999999,y,discovery,,"Now I don't think they didn't even checked the first page of it, but for me it's kinda strange that my story is still locked at 28 views, I don't think the algorithm is so bad there.",t3_1sh3r42
world,77,58,0.4025974025974026,0.0237623376623376,n,generic,,"I want story of an ALTERNATIVE girl, piercings, pale skin, long black hair, struggling, fragile, lost kind of artistry soul in her own world and guy in her age(lil older), white, brown curly hair falling into his face, rough features, dark ",t3_1rynt85
account,76,41,0.3552631578947368,-0.0273434210526315,y,platform_feature,"highest-pain top-frequency aspect (36% neg, mean -0.03) — own deep-dive","they didnt even ask for fucking verification in the same email i was told ""we dont take identity verficiation as proof of ownership but since you said the birthday was lied about we are closing it because that violates the terms of service""",t3_1suqpi9
idea,76,63,0.2894736842105263,0.1408763157894736,n,generic,,It's not the lack of ideas or imagination it's that I'm scared of failure and the possibility of hating  writing all together because of this .,t3_1t1qh6a
friend,69,52,0.1594202898550724,0.4324289855072464,y,community,,"At the very beginning, she’s struggling to survive with an abusive mother and loneliness with only two friends, and she starts to turn things around when they’re attacked by wolves in chapter 5.",t3_1sg4idx
lover,65,47,0.0615384615384615,0.5114384615384617,y,community,"ambiguous: 'fanfic lover', 'romance lover' (community) vs 'wattpad lover' (platform)","SOO plss some books, but no dark romance or abusive shit in the name of enemies to lovers.",t3_1skzb37
title,64,57,0.140625,0.230575,y,platform_feature,,"As the title says, sick of seeing the same old stories with little to no originality on Wattpad.",t3_1sghgvl
help,62,53,0.032258064516129,0.5823870967741938,n,generic,,"If not, send help.",t3_1t4c9h4
novel,59,42,0.0847457627118644,0.3862033898305084,n,generic,,"*Firefox Rising* is the first novel in *Daughters of Dominion*, a fantasy trilogy of rising power, political danger, and found family forged in fire.",t3_1six0b8
recommendation,57,50,0.0350877192982456,0.2674245614035087,y,discovery,,I'll the drop the link below incase anyone wants recommendations.,t3_1soqaov
fanfic,57,51,0.1929824561403508,0.2106964912280701,y,community,,"Malec/Shadowhunter. &amp;#x200B;

Looking for any one who will write a fanfic about Magnus and Alec from shadowhunters about Alec being half warlock half Shadowhunter and he knows about his identity but keeps it a secret while practicing ma",t3_1srr3rk
question,55,50,0.2,0.1292763636363636,n,generic,,"But between her own habits, the pressure around her, and the situations she keeps falling into, Sienna has one question she can’t ignore: Is she even ready for a relationship… if she doesn’t even know how to say no?

the only thing is that ",t3_1shwy28
enemy,50,43,0.12,0.4125820000000001,n,content_topic,,"SOO plss some books, but no dark romance or abusive shit in the name of enemies to lovers.",t3_1skzb37
point,50,41,0.24,0.143142,n,generic,,"As someone who’s been on wattpad for a little under a decade at this point, it sometimes saddens me to see how much it has changed for the negative with all the invasive ads.",t3_1t4h6b8
amp,49,38,0.1428571428571428,0.1606408163265306,n,noise,,"Please proceed with caution if you are sensitive to any of the following:

**Violence &amp; Gore** – depictions of physical harm, blood, death, and body horror.",t3_1ookvfj
end,48,45,0.1666666666666666,0.2175333333333333,n,generic,,"so there's this bxb book that has sat half-read In my library for months and today I decided that I was gonna finish reading it only to be completely caught off guard when the main characters boyfriend fucking DIES at the end, mind you I ch",t3_1sg8fgq
girl,48,34,0.2916666666666667,0.15191875,n,content_topic,,"the plot is insane: this guy marries a girl just to ruin her life as revenge for his family, but then he realizes he has the wrong woman.",t3_1stk2so
community,48,40,0.1041666666666666,0.3930416666666667,y,community,,"Dreamland Community: Book Clubs, Discord, Community, Oh My!.",t3_1qfgkhh
mmc,47,19,0.4680851063829787,-0.0660404255319149,n,content_topic,,"but atp this not necessarily in love with each other but they're starting to develop 

\-the FMC is being hurt and the MMC begs them to stop and gives them what they want (something important of the MMC and did not what to give away but had",t3_1swt3e4
problem,47,40,0.7659574468085106,-0.2428255319148935,n,generic,,But the problem is that I absolutely hate when the author don't finish their book .. it haunts me in my sleep!,t3_1t1qh6a
username,47,39,0.1914893617021276,0.1476361702127659,y,platform_feature,,Im also up for doing a vote for vote so just drop your usernames and ill vote your story vice versa.,t3_1orr5b0
eye,46,27,0.2826086956521739,-0.0468152173913043,n,generic,,"The angle was awkward as hell, pink-tinged water streaming into my eyes.",t3_1smj47m
opinion,46,43,0.1739130434782608,0.2163434782608695,y,community,,I wanna know your opinions about my very first published thing and it's all about a Roblox game called Death Penalty (if you know one).,t3_1t5fmik
app,46,34,0.1304347826086956,0.1086869565217391,y,platform_feature,,"What is wrong with this app?

I really want to see what's inside 😭😭",t3_1tepg5k
wattpad story,46,42,0.0434782608695652,0.2008239130434782,y,platform_feature,,Okay that's all😃😃 any suggestions fake scenarios 😭😭😭 I will share my wattpad story once it got finished 😭😭🤞🤞,t3_1tb31z3
advice,45,38,0.0666666666666666,0.3506866666666667,y,community,,"I’ve read a few discussions about other writers being discouraged because their stories weren’t getting “enough” reads, so I wanted to pop in and lend some advice: 

Wattpad’s algorithm favors hot topics, rapid fire uploads, and completed s",t3_1smorqh
hand,45,25,0.0444444444444444,0.2889577777777777,n,generic,,"His hands crushed bones, snapped weapons, and silenced voices that had just begun to believe.",t3_1spej3p
tag,45,29,0.2444444444444444,0.1503755555555556,y,platform_feature,24% neg — tag system limitations,"so there's this bxb book that has sat half-read In my library for months and today I decided that I was gonna finish reading it only to be completely caught off guard when the main characters boyfriend fucking DIES at the end, mind you I ch",t3_1sg8fgq
fmc,44,18,0.4545454545454545,-0.0489090909090909,n,content_topic,,"Second story: The FMC works at a dangerous criminal organisation, trained to manipulate, deceive, and eliminate threats.",t3_1srcitu
fantasy,43,38,0.1395348837209302,0.3768976744186046,n,content_topic,,"Idk who needs to hear this today but as long as you understand the difference between fantasy and reality, you are allowed to have whatever insane tastes you have.",t3_1sx79mi
boy,43,22,0.3255813953488372,0.1320813953488372,n,content_topic,,One boy is trapped in a mind that has betrayed him.,t3_1spk96y
man,43,35,0.5581395348837209,-0.1425953488372092,n,content_topic,,"But among all the people they thought they could deceive, they chose a cold-blooded, cruel, and ruthless man named Brian Stone — a man who had suffered from early-stage brain cancer for half his life and who, for many years, has devoted him",t3_1svnand
family,41,40,0.4634146341463415,0.0054414634146341,n,content_topic,,"We're talking about individuals who have murdered innocents, dissolved children in acid, extorted families, and destroyed entire communities through fear and violence.",t3_1lj5s7r
thought,41,35,0.1219512195121951,0.1979853658536585,n,generic,,"TWs- self harm, suicidal thoughts, depression, anxiety, what not.

give it a try and lemme know your thoughts.",t3_1tc3qla
smut,38,31,0.2894736842105263,0.1306631578947368,n,content_topic,,"But between her own habits, the pressure around her, and the situations she keeps falling into, Sienna has one question she can’t ignore: Is she even ready for a relationship… if she doesn’t even know how to say no?

the only thing is that ",t3_1shwy28
english,37,35,0.1621621621621621,0.1801,y,platform_feature,,but I just really want to understand if I’m doing good cause I’m Italian and I’m scared my English is a bit ugh),t3_1snjk1n
plot,36,35,0.25,0.1350055555555555,n,content_topic,,"The basic summary of the plot and characters are as follows, i dont remember both characters name but the mans name is Grey, its a romance story, Basically the female main characters home life is terrible, her father drinks and is abusive a",t3_1ta9bsh
support,36,35,0.0555555555555555,0.6388027777777778,y,community,,A part of me was worried I would receive no support at all!,t3_1svjv15
content,36,28,0.1666666666666666,0.1451583333333333,n,generic,,We do not transfer or restore content/accounts that have been removed for violating Wattpad guidelines and policies.,t3_1tdaq7r
thank,36,34,0.0277777777777777,0.5851166666666668,n,generic,,"Thanks for your TED Talk, Karen, but who the hell asked?

I mean, what a tragedy?",t3_1l9ld42
tip,35,31,0.0285714285714285,0.2732485714285714,y,monetization,,"Tricks, tips or magic spells​​ that I am missing?",t3_1szzpea
platform,34,28,0.1176470588235294,0.297785294117647,n,generic,,After finishing the twilight fanfictics I realized how truly awful and useless the search/filter system in that completely ruined the platform for me.,t3_1md14g6
head,34,24,0.2352941176470588,0.0899264705882353,n,generic,,"I want story of an ALTERNATIVE girl, piercings, pale skin, long black hair, struggling, fragile, lost kind of artistry soul in her own world and guy in her age(lil older), white, brown curly hair falling into his face, rough features, dark ",t3_1rynt85
mind,34,28,0.3235294117647059,-0.0016088235294117,n,generic,,"So just got a comment on a fic of mine calling my character bland because instead of speaking her mind constantly she is cautious and thinks about the possible consequences of her actions for herself, her family and her young children and t",t3_1t4hvx5
fanfiction,32,27,0.25,0.1164343749999999,y,community,,"All I ask is you be aware I won't pick fanfictions for things I know nothing about, and that I try to avoid swearing.",t3_1si9ggo
engagement,32,24,0.09375,0.544025,y,discovery,,So tired of Wattpad authors whining about not gaining enough engagement.,t3_1sx422n
main character,32,29,0.25,0.206975,n,content_topic,,"After a brutal incident, the main character discovers he can see and fight what others cannot.",t3_1shm451
new chapter,31,30,0.1290322580645161,0.1181709677419354,y,platform_feature,,"The first time I hit ""preview"" after I pasted a piece of my writing (on the website), it merges together around 500 hundred words 😭​​. This happens in every new chapter.",t3_1suhdcu
number,30,26,0.1,0.3134833333333334,n,generic,,"Something about numbers and something about I caught the word *""semanas""* \[weeks\] and the word *""grave""* \[serious\] and then a whole river of words I couldn't follow at all.",t3_1sqv201
suggestion,30,26,0.2,0.1583233333333334,y,discovery,,Okay that's all😃😃 any suggestions fake scenarios 😭😭😭 I will share my wattpad story once it got finished 😭😭🤞🤞,t3_1tb31z3
series,30,28,0.1666666666666666,0.1704,n,generic,,"Through a series of events, Neo loses his mind and begins hunting and killing 14 women who resemble his owner.",t3_1t9yaxp
moment,30,26,0.1666666666666666,0.1935533333333333,n,generic,,"It probably makes for a cool reading experience, but it is really annoying the moment I try to patch a mistake.",t3_1t4c9h4
follower,29,21,0.3103448275862069,0.059751724137931,y,discovery,31% neg — bot-follower problem? unfollow churn?,I unblock and tell the user to grow up and leave me alone and also post on my message board asking my followers how to report someone for harassment.,t3_1jrn98y
relationship,29,19,0.3103448275862069,0.1617137931034483,n,generic,,"But between her own habits, the pressure around her, and the situations she keeps falling into, Sienna has one question she can’t ignore: Is she even ready for a relationship… if she doesn’t even know how to say no?

the only thing is that ",t3_1shwy28
reason,29,27,0.2413793103448276,0.1092206896551724,n,generic,,"No books about degradation/ arranged or forced marriage/Ntr/ rape etc.

Just send your descriptions if Its 18+ for any reason explain it why is it with an extra note.",t3_1tbxd83
chance,29,26,0.2413793103448276,0.3768310344827586,n,generic,,"And if they choose to be together, will they be able to bridge the divide between their families, or will the hurricane of their parents' hatred destroy their chance at a calm future?",t3_1skre80
reading list,28,23,0.1071428571428571,0.2342749999999999,y,platform_feature,,so I've been STARVED of grovel since I already went through most of the grovel on my reading lists,t3_1rz2f8f
dark romance,28,20,0.2142857142857142,0.3782285714285713,n,content_topic,,"SOO plss some books, but no dark romance or abusive shit in the name of enemies to lovers.",t3_1skzb37
scene,28,25,0.2857142857142857,0.1889107142857143,n,content_topic,,"and I genuinely can’t tell if people would love this or if it would completely flop 😭

How interested would you be in a psychological thriller story where readers actively influence the narrative through polls/choices?

Not quite “choose yo",t3_1te5m2y
face,28,18,0.2857142857142857,-0.0598428571428571,n,generic,,"I want story of an ALTERNATIVE girl, piercings, pale skin, long black hair, struggling, fragile, lost kind of artistry soul in her own world and guy in her age(lil older), white, brown curly hair falling into his face, rough features, dark ",t3_1rynt85
action,27,24,0.2222222222222222,0.2028629629629629,n,generic,,"Blurb: When Elle Claude, a thief from the city of Sin Capital, steals a locket from a man in the underground metro, she soon discovers the supernatural ramifications of her actions.",t3_1sml0b2
notification,27,22,0.3333333333333333,-0.0043518518518518,y,platform_feature,33% neg — likely push/email noise or missed mentions,"Usually, if I unblock them and block them again, those notifications stop.",t3_1tbpjxg
issue,26,23,0.1538461538461538,0.2144769230769231,n,generic,,But I just hate when things get resolved too quickly as if the conflict or issue didn’t really matter.,t3_1t11eam
blurb,26,23,0.2307692307692307,0.0956230769230769,y,platform_feature,,"Blurb: When Elle Claude, a thief from the city of Sin Capital, steals a locket from a man in the underground metro, she soon discovers the supernatural ramifications of her actions.",t3_1sml0b2
bot,26,17,0.2692307692307692,0.0409615384615384,y,platform_feature,,but then I deleted it because it was full of bots and the books just kinds sucked so I made a new one.,t3_1sq1l9k
line,26,24,0.4230769230769231,0.0531730769230769,n,generic,,What happens when the line between hate and something else blurs in a situation where it could put everything they've worked for in jeopardy?,t3_1srcitu
sense,26,26,0.2307692307692307,0.2604692307692308,n,generic,,"Now kill for you can absolutely work when the stakes make sense:

\-",t3_1sx5zbj
war,25,14,1.0,-0.701404,n,content_topic,,"But when their lives change as they get pulled into a war far from home, much bigger than both of them, they will have to face new enemies, threats and rivals unlike anything they encountered before while untold feelings slowly crawl out of",t3_1ssyf8u
experience,25,21,0.08,0.3436519999999999,n,generic,,I didn't even know why I attempted to write one when I have NO experience in writing at all.,t3_1sjpha7
new writer,25,24,0.32,0.1410039999999999,y,community,,I would really appreciate some harsh criticism as I am a new writer.,t3_1tan5mu
cover,25,18,0.12,0.14634,y,platform_feature,12% neg but cover scams + cover-tool gaps both live here,"You're going to read all of this and get upset in the comments, tell me readers shouldn't care about a cover, title, or description, and that it's all about the content, you're going to tell me that you write for yourself, that you write wh",t3_1hnfukn
slow burn,25,22,0.2,0.2497039999999999,n,content_topic,,"It’s a slow burn and it has tons of drama, conflict, tension, angst, and yearning that aches.",t3_1stmnop
update,25,19,0.28,0.133976,y,platform_feature,,"However, nearly two years have passed since then, and there has been no news about shipping, no updates, and no communication from the author.",t3_1soajhf
draft,24,19,0.2083333333333333,0.2243708333333333,y,platform_feature,,"New writers posting or have not even post, just have drafts left on wattpad and are looking for some criticism.",t3_1tbxd83
reading,24,23,0.125,0.3334749999999999,n,generic,,I have no interest in sorting through 1000s of terrible stories to find the hidden gems i am actually interesting in reading.,t3_1md14g6
feeling,24,15,0.2083333333333333,0.0801541666666666,n,generic,,"They slowly develop feelings, but a major conflict happens when the FMC suspects a business deal is manipulated—no one, including the MMC, believes her.",t3_1t3qx3i
example,24,20,0.125,0.130675,n,generic,,"For example, *""But if the world will label them as villains, they might as well give them a reason to be afraid.",t3_1spk96y
audience,23,19,0.2608695652173913,0.1642913043478261,y,discovery,,"That means the wrong readers see my work, do not engage with it, and the algorithm keeps pushing it further away from the audience it actually needs.",t3_1sle6od
woman,23,19,0.391304347826087,-0.0293478260869565,n,content_topic,,"NO REASON TO CALL ANYONE WHAT THEY DID AND TO procced to call me the reason women don't feel safe around men like what the fuck I was just reading a story I'm sorry that I like reading and the premise of your story was decent 

P.S lf possi",t3_1m5h9md
door,23,11,0.2608695652173913,-0.0104347826086956,n,generic,,"\-The FMC is being harassed/touch by someone and MMC stops it and beat them

\-The MMC knocks on the door the FMC opens it and MMC is really hurt.",t3_1swt3e4
honest feedback,23,22,0.0869565217391304,0.6146826086956522,y,community,,"It’s a romance-comedy fantasy about an exhausted office woman who dies, refuses reincarnation, and accidentally drags the Grim Reaper along with her 💀

I genuinely want honest feedback because I’m still learning how to write engaging charac",t3_1tcoznp
description,23,19,0.217391304347826,0.0304782608695652,y,platform_feature,,"No books about degradation/ arranged or forced marriage/Ntr/ rape etc.

Just send your descriptions if Its 18+ for any reason explain it why is it with an extra note.",t3_1tbxd83
profile,23,19,0.0434782608695652,0.211995652173913,y,platform_feature,,"So last night I found a post warning everyone about a disgusting creature with pornographic photos and books of minors, I went to search up this creature earlier to report him again, PROFILE IS GONE!",t3_1mbiezv
short story,23,20,0.0869565217391304,0.1237391304347826,n,content_topic,,I wrote my first short story [paranormal horror short story].,t3_1teb796
story link,23,19,0.0434782608695652,0.192195652173913,y,platform_feature,,"I just copied a link from my story to send to somebody, and when I pasted it on to their message board this lower paragraph appeared attached to my story link.",t3_1st291t
rec,23,20,0.1739130434782608,0.3200173913043478,y,discovery,,I’m hooked on Taekook ffs—need more recs 😭.,t3_1ssk7xf
beta reader,22,14,0.0,0.319,y,service,,Any Fanfic Writers Looking For A Beta Reader?.,t3_1ouf1bu
group,22,15,0.0909090909090909,0.1247636363636363,n,generic,,"People are broken up into three groups, and every update, (a) book(s) is/are featured for that group to read from its group members.",t3_1qfgkhh
secret,22,22,0.3636363636363636,0.0927318181818181,n,generic,,"Malec/Shadowhunter. &amp;#x200B;

Looking for any one who will write a fanfic about Magnus and Alec from shadowhunters about Alec being half warlock half Shadowhunter and he knows about his identity but keeps it a secret while practicing ma",t3_1srr3rk
user,22,18,0.2272727272727272,0.1795318181818181,y,platform_feature,,"For your convenience, here is the full rule description:

&gt;Do not provide another user's information with the intention of directing others to shame, brigade, or otherwise harass.  
&gt;  
&gt;Additionally,  posts shaming other users for",t3_1hbt6wg
